name,website,phone,email,address,services,google_rating,google_reviews_count,source,source_url,scraped_at
Top Sydney Digital Marketing Agencies,,,,"Sydney’s business scene stretches from the tech startups of Surry Hills to the global enterprises clustered around Barangaroo. Whether you’re a scaling SaaS firm or a heritage retailer on George Street, a well-rounded digital marketing partner can amplify your brand across Australia and beyond. Clutch makes that search easier. Our platform features in-depth client reviews, service line breakdowns, and quantitative performance ratings so you can quickly shortlist agencies that fit your budget, timeline, and growth goals. Use filters for hourly rate, industry focus, or project size to zero in on the right Sydney team.","Global list of Top Digital Marketing Companies, Nearby market: Digital Marketing Agencies in Melbourne, Niche filter: Sydney agencies for E-Commerce marketing",,,clutch,https://clutch.co/au/agencies/digital-marketing/sydney,2026-02-03T10:28:09.708378+00:00
2 - 9,,,,"Serves Sydney, Australia","10% Ecommerce Marketing, Pure Bold is a web development and digital marketing agency known for its comprehensive services, including website design, brand strategy, and marketing solutions. The company boasts a high level of customer satisfaction, with 100% of reviewers highlighting their exceptional project management, timely delivery, and personalized approach. Clients consistently praise their ability to understand and meet specific business needs, while no negative feedback was reported.",20.0,,clutch,https://clutch.co/au/agencies/digital-marketing/sydney,2026-02-03T10:28:09.711967+00:00
10 - 49,,,,"Serves Sydney, Australia","25% Social Media Marketing, farsiight is a digital marketing agency specializing in Google Ads and SEO services, with a keen focus on optimizing ad campaigns to enhance traffic, conversions, and Return on Ad Spend (ROAS). They are highly praised for being proactive, responsive, and delivering on time, with 100% of reviewers highlighting their excellent communication and cultural fit.",25.0,,clutch,https://clutch.co/au/agencies/digital-marketing/sydney,2026-02-03T10:28:09.712262+00:00
250 - 999,,,,"Serves Sydney, Australia","15% Social Media Marketing, 10% Blockchain Marketing, Ninja Promo is a digital marketing and social media agency renowned for its expertise in SEO, Google Ads, brand positioning, social media marketing, and content creation. With a high rating and noted for good value, 88% of reviews reflect positive experiences, highlighting effective project management, timely deliverables, and proactive communication. However, 12% of reviews indicated areas for improvement, particularly in campaign execution and responsiveness.",15.0,,clutch,https://clutch.co/au/agencies/digital-marketing/sydney,2026-02-03T10:28:09.712516+00:00
50 - 249,,,,"Sydney, Australia","75% Content Marketing, Brafton is a comprehensive content marketing agency known for delivering a range of services including SEO, copywriting, video production, and graphic design. They are praised for their professionalism, project management, and ability to meet deadlines, with 100% of reviewers noting timely delivery and clear communication. Clients appreciate their adaptability and strategic insights, with over 90% expressing satisfaction and highlighting their collaborative approach.",75.0,,clutch,https://clutch.co/au/agencies/digital-marketing/sydney,2026-02-03T10:28:09.714075+00:00
2 - 9,,,,"Sydney, Australia","20% Social Media Marketing, Soup Agency is a digital marketing firm specializing in SEO, email strategy, and social media lead generation. Reviews indicate a 100% positive approval rating, highlighting their exceptional project management, timely delivery, and strategic creativity. Notably, 90% of clients commend their ability to align with brand values and enhance digital presence, while 80% emphasize their responsiveness and communication.",20.0,,clutch,https://clutch.co/au/agencies/digital-marketing/sydney,2026-02-03T10:28:09.714334+00:00
10 - 49,,,,"North Sydney, Australia","20% Social Media Marketing, Inspaceweb is a comprehensive digital services company offering web design, development, SEO, social media marketing, and cloud hosting solutions. Reviews indicate a 100% satisfaction rate, with clients praising their professionalism, seamless communication, and ability to deliver customized, high-quality digital solutions. The firm's strong project management and effective collaboration are frequently noted, and they are valued for their transparency and dedication to client success.",20.0,,clutch,https://clutch.co/au/agencies/digital-marketing/sydney,2026-02-03T10:28:09.716048+00:00
10 - 49,,,,"Sydney, Australia","40% Demand Generation Marketing, 20% Content Marketing, 20% Marketing Strategy, Crowd Box Pty Ltd is a lead generation and telemarketing company that provides sales development services, including appointment setting and account-based marketing strategies. The company has received overwhelmingly positive feedback, with clients praising their project management, responsiveness, and ability to deliver quality leads. Approximately 95% of reviewers commend their communication and adaptability, though some note room for improvement in reporting formats.",40.0,,clutch,https://clutch.co/au/agencies/digital-marketing/sydney,2026-02-03T10:28:09.718151+00:00
"1,000 - 9,999",,,,"Sydney, Australia","20% Content Marketing, SGK is a creative agency specializing in innovative content development, packaging design, digital experiences, and production services. Overall, their reviews are highly positive, with approximately 90% of clients praising their strong project management, creativity, and ability to meet deadlines. Clients consistently highlight SGK's proactive approach, flexibility, and alignment with client values, although some suggest potential improvements in communication structure and cost efficiency.",20.0,,clutch,https://clutch.co/au/agencies/digital-marketing/sydney,2026-02-03T10:28:09.727080+00:00
2 - 9,,,,"North Sydney, Australia","15% Content Marketing, 15% Email Marketing, SAVV DIGITAL is a full-service digital marketing agency specializing in B2B marketing, lead generation, and content marketing. The company consistently receives positive feedback for its expertise in digital marketing and ability to deliver tangible results, with 100% of reviews noting their effective communication and responsiveness. Clients appreciate SAVV DIGITAL's comprehensive service offerings and their capacity to enhance brand awareness and digital marketing strategies.",25.0,,clutch,https://clutch.co/au/agencies/digital-marketing/sydney,2026-02-03T10:28:09.727456+00:00
50 - 249,,,,"North Sydney, Australia",15% Ecommerce Marketing,60.0,,clutch,https://clutch.co/au/agencies/ppc/sydney,2026-02-03T10:28:17.083506+00:00
